{
  "schema": "production_receipt.v1",
  "node_id": "parse",
  "status": "completed",
  "input_checksum": "b41d4394692dab75bdaf6c818262d73b18962c2916c6fbb983316d7f370b2e81",
  "version_refs": {"dsh": "0.1.1-rc.2", "macOS": "26.6.2", "hardware": "Apple M4 24GB", "funasr": "1.3.22", "mlx-audio": "0.4.5"},
  "actual_bindings": {"tools": ["git", "lsof", "shasum", "rg", "local Python probes"]},
  "artifacts": ["runtime inventory", "dirty-worktree inventory", "critical source hashes"],
  "qa_result": {"status": "passed", "checks": ["HEAD frozen", "running 3080 listener identified", "installed app identified", "dirty user changes preserved", "model runtimes verified"]},
  "evidence": ["HEAD 5e8bdf6dccad614b18e27d86a6b0bdcc334c937e on main.", "DSH 0.1.1-rc.2 is listening on 127.0.0.1:3080.", "/Applications/大神.app arm64 binary is running.", "Existing worktree changes were inventoried without reset or cleanup."],
  "failure_fingerprint": null,
  "rollback_to": "route"
}
