{
  "schema": "production_receipt.v1",
  "node_id": "parse",
  "status": "completed",
  "input_checksum": "77e900e3886bfa5e689ba6ef5e54c2c3cd8f944e913a52ae8cd6591404304603",
  "version_refs": {"connector": "0.6.2", "dws": "1.0.60"},
  "actual_bindings": {"source": "local runtime plus official dws help"},
  "artifacts": ["profiles/web/node_modules/@dingtalk-real-ai/dsh-dingtalk/lib/commands.js", "profiles/web/node_modules/@dingtalk-real-ai/dsh-dingtalk/lib/tools.js"],
  "qa_result": {"status": "passed", "checks": ["确认原链路只发送文字和卡片", "确认 dws 支持机器人本地 file 发送"]},
  "evidence": ["原 /artifacts 明确不上传", "dws send-by-bot --msg-type file --file-path help and dry-run"],
  "failure_fingerprint": null,
  "rollback_to": "route"
}
